{
  "$schema": "https://json-schema.org/draft/2020-12/schema",
  "$id": "https://raw.githubusercontent.com/slastrina/rattleboard-plugins/main/schema/plugin.schema.json",
  "title": "Rattleboard plugin manifest (format 1), community repo rules",
  "description": "Mirrors the desktop app's validation (rattleboard-core/src/plugins.rs) for the kinds this repo accepts. Command plugins are not accepted. tools/build-index.mjs is the authoritative check (it also checks durations and their limits, JSONPath syntax, setting defaults and that every placeholder is declared).",
  "type": "object",
  "required": [
    "format",
    "id",
    "name",
    "kind"
  ],
  "properties": {
    "$schema": {
      "type": "string"
    },
    "format": {
      "const": 1
    },
    "id": {
      "type": "string",
      "minLength": 3,
      "maxLength": 100,
      "pattern": "^(?!rattleboard\\.)[a-z0-9.-]+$",
      "description": "Reverse-DNS style, lower case; must equal the plugin's folder name"
    },
    "name": {
      "type": "string",
      "minLength": 1,
      "maxLength": 60,
      "pattern": "\\S"
    },
    "description": {
      "type": "string",
      "maxLength": 300
    },
    "kind": {
      "enum": [
        "rss",
        "json",
        "ical",
        "text",
        "script"
      ],
      "description": "command plugins are not accepted in this repo; script needs Rattleboard 0.8.0"
    },
    "script": {
      "type": "string",
      "pattern": "^[A-Za-z0-9_-][A-Za-z0-9._-]{0,96}\\.js$",
      "description": "For script plugins (0.8.0+): the JavaScript module next to the manifest, usually script.js"
    },
    "hosts": {
      "type": "array",
      "maxItems": 20,
      "uniqueItems": true,
      "items": {
        "type": "string",
        "pattern": "^(\\*\\.)?[A-Za-z0-9-]+(\\.[A-Za-z0-9-]+)+\\.?$"
      },
      "description": "For script plugins: the only hosts ctx.fetch may reach (exact names, or *.example.com for any subdomain); [] for none"
    },
    "permissions": {
      "type": "array",
      "maxItems": 0,
      "description": "Reserved for script plugins; none are defined yet"
    },
    "fetch": {
      "type": "object",
      "required": [
        "url"
      ],
      "properties": {
        "url": {
          "type": "string",
          "minLength": 9,
          "maxLength": 2000,
          "pattern": "^\\s*https://",
          "description": "https:// only. Placeholders: {{settings.x}}, {{secret.x}}, {{now:format}}"
        },
        "method": {
          "type": "string",
          "pattern": "^([Gg][Ee][Tt]|[Pp][Oo][Ss][Tt])$"
        },
        "headers": {
          "type": "object",
          "maxProperties": 20,
          "propertyNames": {
            "pattern": "^[!#$%&'*+\\-.^_`|~0-9A-Za-z]+$"
          },
          "additionalProperties": {
            "type": "string",
            "maxLength": 4000
          }
        },
        "every": {
          "$ref": "#/$defs/duration",
          "description": "At least 1m, at most 7d; default 15m"
        },
        "sign": {
          "type": "object",
          "description": "Format 1.1: HMAC signature over the URL's path and query, appended as a query parameter (PTV v3's scheme)",
          "required": [
            "type",
            "key"
          ],
          "properties": {
            "type": {
              "enum": [
                "hmac-sha1",
                "hmac-sha256"
              ]
            },
            "key": {
              "type": "string",
              "minLength": 1,
              "maxLength": 500,
              "description": "Usually {{secret.key}}"
            },
            "over": {
              "const": "path+query"
            },
            "param": {
              "type": "string",
              "pattern": "^[A-Za-z0-9_.-]{1,40}$",
              "default": "signature"
            },
            "case": {
              "enum": [
                "upper",
                "lower"
              ],
              "default": "upper"
            }
          }
        }
      }
    },
    "every": {
      "$ref": "#/$defs/duration",
      "description": "For text plugins: how often the card is re-drawn (at least 10s)"
    },
    "pick": {
      "type": "object",
      "properties": {
        "items": {
          "$ref": "#/$defs/path"
        },
        "id": {
          "$ref": "#/$defs/path"
        },
        "title": {
          "$ref": "#/$defs/path"
        },
        "body": {
          "$ref": "#/$defs/path"
        },
        "time": {
          "$ref": "#/$defs/path"
        },
        "fields": {
          "type": "object",
          "maxProperties": 20,
          "description": "Format 1.1: extra values for templates as {{field.name}}",
          "propertyNames": {
            "pattern": "^[A-Za-z0-9_]{1,40}$"
          },
          "additionalProperties": {
            "oneOf": [
              {
                "$ref": "#/$defs/path"
              },
              {
                "type": "array",
                "minItems": 1,
                "maxItems": 5,
                "items": {
                  "$ref": "#/$defs/path"
                }
              }
            ]
          }
        },
        "where": {
          "type": "array",
          "maxItems": 20,
          "description": "Format 1.1: every item must meet all of these",
          "items": {
            "type": "object",
            "required": [
              "path",
              "op"
            ],
            "properties": {
              "path": {
                "$ref": "#/$defs/path"
              },
              "op": {
                "enum": [
                  "==",
                  "!=",
                  ">",
                  ">=",
                  "<",
                  "<=",
                  "contains",
                  "exists",
                  "missing"
                ]
              },
              "value": {
                "type": [
                  "string",
                  "number",
                  "boolean"
                ],
                "description": "Not for exists/missing. A string may use {{settings.x}}; a placeholder that comes out blank switches the condition off"
              },
              "when": {
                "type": "object",
                "required": [
                  "setting",
                  "is"
                ],
                "properties": {
                  "setting": {
                    "type": "string"
                  },
                  "is": {
                    "oneOf": [
                      {
                        "type": "string"
                      },
                      {
                        "type": "array",
                        "minItems": 1,
                        "maxItems": 20,
                        "items": {
                          "type": "string"
                        }
                      }
                    ]
                  }
                }
              }
            }
          }
        },
        "sort": {
          "type": "object",
          "required": [
            "path"
          ],
          "description": "Format 1.1",
          "properties": {
            "path": {
              "$ref": "#/$defs/path"
            },
            "order": {
              "enum": [
                "asc",
                "desc"
              ],
              "default": "asc"
            },
            "numeric": {
              "type": "boolean",
              "description": "Omit for automatic: numeric when every key is a number"
            }
          }
        },
        "as": {
          "enum": [
            "feed",
            "status"
          ],
          "default": "feed",
          "description": "Format 1.1: status shows the list as one card ({{rows}}) instead of a feed of new items"
        },
        "link": {
          "$ref": "#/$defs/path",
          "description": "Format 1.1: the item's web address (http or https), opened by clicking the board"
        }
      }
    },
    "card": {
      "type": "object",
      "properties": {
        "template": {
          "type": "string",
          "maxLength": 2000,
          "not": {
            "pattern": "\\{\\{\\s*secret\\."
          }
        },
        "chip": {
          "oneOf": [
            {
              "enum": [
                "",
                "none",
                "red",
                "orange",
                "yellow",
                "green",
                "blue",
                "violet",
                "white",
                "black"
              ]
            },
            {
              "type": "integer",
              "minimum": 63,
              "maximum": 70
            }
          ]
        },
        "align": {
          "enum": [
            "center",
            "centre",
            "left"
          ]
        },
        "pages": {
          "type": "integer",
          "minimum": 1,
          "maximum": 3
        },
        "row": {
          "type": "string",
          "maxLength": 2000,
          "not": {
            "pattern": "\\{\\{\\s*secret\\."
          },
          "description": "Format 1.1, status lists: each item's line, joined into {{rows}}"
        },
        "empty": {
          "type": "string",
          "maxLength": 2000,
          "not": {
            "pattern": "\\{\\{\\s*secret\\."
          },
          "description": "Format 1.1, status lists: the card when no item is left"
        }
      }
    },
    "priority": {
      "enum": [
        "ambient",
        "alert"
      ]
    },
    "alertWhen": {
      "type": "array",
      "maxItems": 50,
      "items": {
        "type": "string",
        "pattern": "^keyword:\\s*\\S"
      }
    },
    "maxItems": {
      "type": "integer",
      "minimum": 1,
      "maximum": 50,
      "description": "At most this many items (default 10), applied after pick.where and pick.sort"
    },
    "dwell": {
      "$ref": "#/$defs/duration",
      "description": "10s to 1h"
    },
    "newEachTime": {
      "type": "boolean",
      "description": "Rattleboard 0.10.7+, for script, json and command: run again as soon as the card has been shown, so it's different next time round (at most once a minute). Older versions ignore it."
    },
    "schedule": {
      "type": "object",
      "properties": {
        "days": {
          "type": "array",
          "items": {
            "type": "string",
            "pattern": "^([Mm][Oo][Nn]|[Tt][Uu][Ee]|[Ww][Ee][Dd]|[Tt][Hh][Uu]|[Ff][Rr][Ii]|[Ss][Aa][Tt]|[Ss][Uu][Nn])"
          }
        },
        "from": {
          "$ref": "#/$defs/hhmm"
        },
        "to": {
          "$ref": "#/$defs/hhmm"
        }
      },
      "dependentRequired": {
        "from": [
          "to"
        ],
        "to": [
          "from"
        ]
      }
    },
    "settings": {
      "type": "array",
      "maxItems": 30,
      "items": {
        "type": "object",
        "required": [
          "key"
        ],
        "properties": {
          "key": {
            "$ref": "#/$defs/key"
          },
          "label": {
            "type": "string"
          },
          "type": {
            "enum": [
              "text",
              "number",
              "toggle",
              "select",
              "date",
              "time",
              "lines"
            ]
          },
          "options": {
            "type": "array"
          },
          "default": {}
        },
        "if": {
          "properties": {
            "type": {
              "const": "select"
            }
          },
          "required": [
            "type"
          ]
        },
        "then": {
          "required": [
            "options"
          ],
          "properties": {
            "options": {
              "minItems": 1
            }
          }
        }
      }
    },
    "secrets": {
      "type": "array",
      "maxItems": 10,
      "items": {
        "type": "object",
        "required": [
          "key"
        ],
        "properties": {
          "key": {
            "$ref": "#/$defs/key"
          },
          "label": {
            "type": "string"
          }
        }
      }
    },
    "run": false
  },
  "allOf": [
    {
      "if": {
        "properties": {
          "kind": {
            "enum": [
              "rss",
              "json",
              "ical"
            ]
          }
        }
      },
      "then": {
        "required": [
          "fetch"
        ]
      }
    },
    {
      "if": {
        "properties": {
          "kind": {
            "const": "text"
          }
        }
      },
      "then": {
        "required": [
          "card"
        ],
        "properties": {
          "card": {
            "required": [
              "template"
            ]
          }
        }
      }
    },
    {
      "if": {
        "properties": {
          "kind": {
            "const": "json"
          }
        }
      },
      "then": {
        "anyOf": [
          {
            "required": [
              "pick"
            ],
            "properties": {
              "pick": {
                "required": [
                  "title"
                ]
              }
            }
          },
          {
            "required": [
              "card"
            ],
            "properties": {
              "card": {
                "required": [
                  "template"
                ]
              }
            }
          }
        ]
      }
    },
    {
      "if": {
        "properties": {
          "kind": {
            "const": "script"
          }
        },
        "required": [
          "kind"
        ]
      },
      "then": {
        "required": [
          "script",
          "hosts"
        ],
        "not": {
          "anyOf": [
            {
              "required": [
                "fetch"
              ]
            },
            {
              "required": [
                "pick"
              ]
            },
            {
              "required": [
                "scriptInline"
              ]
            }
          ]
        }
      }
    }
  ],
  "$defs": {
    "duration": {
      "description": "Seconds, or a duration like \"30s\", \"15m\", \"1h\" or \"1h30m\"",
      "oneOf": [
        {
          "type": "integer",
          "minimum": 0
        },
        {
          "type": "string",
          "pattern": "^\\s*(\\d+|(\\d+[smhdSMHD])+)\\s*$"
        }
      ]
    },
    "path": {
      "type": "string",
      "description": "JSONPath subset: $, .key, ['key'], [n] and [*]. May contain {{settings.x}} placeholders.",
      "pattern": "^\\s*(\\$|.*\\{\\{)"
    },
    "hhmm": {
      "type": "string",
      "pattern": "^\\s*(\\d{1,2}:\\d{1,2})?\\s*$"
    },
    "key": {
      "type": "string",
      "pattern": "^[A-Za-z0-9_]{1,40}$"
    }
  }
}
