{
  "format": 1,
  "id": "community.dad-joke",
  "name": "Dad joke",
  "description": "A new dad joke every time it comes round, never one it told recently (icanhazdadjoke.com, no key needed)",
  "kind": "script",
  "script": "script.js",
  "hosts": ["icanhazdadjoke.com"],
  "every": "1h",
  "dwell": "45s",
  "newEachTime": true,
  "card": { "chip": "orange", "pages": 3 }
}
